<?xml version="1.0" encoding="UTF-8" standalone="yes"?>
<components xmlns="http://gov.nasa.arc.mct" xmlns:xsi="http://www.w3.org/2001/XMLSchema-instance" schemaVersion="1" xsi:schemaLocation="http://gov.nasa.arc.mct importExport.xsd">
    <component toplevel="true" owner="Fred" name="Test Name" creator="Ginger" creationDate="2012-07-31T14:05:46.137-07:00" componentType="gov.nasa.arc.mct.importExport.provider.ExporterTest$TestAbstractComponent" componentId="PARENT">
        <associatedComponents id="CHILD"/>
        <modelState>&lt;testModel/&gt;</modelState>
        <viewStates>
            <key>test1</key>
            <value>&lt;extendedInfo&gt;&lt;viewRoleProperties&gt;&lt;entries key=&quot;viewType1&quot;&gt;&lt;value&gt;properties1&lt;/value&gt;&lt;/entries&gt;&lt;entries key=&quot;viewType2&quot;&gt;&lt;value&gt;properties2&lt;/value&gt;&lt;/entries&gt;&lt;/viewRoleProperties&gt;&lt;/extendedInfo&gt;</value>
        </viewStates>
        <viewStates>
            <key>test2</key>
            <value>&lt;extendedInfo&gt;&lt;viewRoleProperties&gt;&lt;entries key=&quot;viewType1&quot;&gt;&lt;value&gt;properties1&lt;/value&gt;&lt;/entries&gt;&lt;entries key=&quot;viewType2&quot;&gt;&lt;value&gt;properties2&lt;/value&gt;&lt;/entries&gt;&lt;/viewRoleProperties&gt;&lt;/extendedInfo&gt;</value>
        </viewStates>
    </component>
    <component toplevel="false" owner="Fred" name="Test Name" creator="Ginger" creationDate="2012-07-31T14:05:46.137-07:00" componentType="gov.nasa.arc.mct.importExport.provider.ExporterTest$TestAbstractComponent" componentId="CHILD">
        <associatedComponents id="PARENT"/>
        <modelState>&lt;testModel/&gt;</modelState>
        <viewStates>
            <key>test1</key>
            <value>&lt;extendedInfo&gt;&lt;viewRoleProperties&gt;&lt;entries key=&quot;viewType1&quot;&gt;&lt;value&gt;properties1&lt;/value&gt;&lt;/entries&gt;&lt;entries key=&quot;viewType2&quot;&gt;&lt;value&gt;properties2&lt;/value&gt;&lt;/entries&gt;&lt;/viewRoleProperties&gt;&lt;/extendedInfo&gt;</value>
        </viewStates>
        <viewStates>
            <key>test2</key>
            <value>&lt;extendedInfo&gt;&lt;viewRoleProperties&gt;&lt;entries key=&quot;viewType1&quot;&gt;&lt;value&gt;properties1&lt;/value&gt;&lt;/entries&gt;&lt;entries key=&quot;viewType2&quot;&gt;&lt;value&gt;properties2&lt;/value&gt;&lt;/entries&gt;&lt;/viewRoleProperties&gt;&lt;/extendedInfo&gt;</value>
        </viewStates>
    </component>
    <component toplevel="true" owner="Fred" name="Test Name" creator="Ginger" creationDate="2012-07-31T14:05:46.140-07:00" componentType="gov.nasa.arc.mct.importExport.provider.ExporterTest$TestAbstractComponent" componentId="PARENT">
        <associatedComponents id="CHILD"/>
        <modelState>&lt;testModel/&gt;</modelState>
        <viewStates>
            <key>test1</key>
            <value>&lt;extendedInfo&gt;&lt;viewRoleProperties&gt;&lt;entries key=&quot;viewType1&quot;&gt;&lt;value&gt;properties1&lt;/value&gt;&lt;/entries&gt;&lt;entries key=&quot;viewType2&quot;&gt;&lt;value&gt;properties2&lt;/value&gt;&lt;/entries&gt;&lt;/viewRoleProperties&gt;&lt;/extendedInfo&gt;</value>
        </viewStates>
        <viewStates>
            <key>test2</key>
            <value>&lt;extendedInfo&gt;&lt;viewRoleProperties&gt;&lt;entries key=&quot;viewType1&quot;&gt;&lt;value&gt;properties1&lt;/value&gt;&lt;/entries&gt;&lt;entries key=&quot;viewType2&quot;&gt;&lt;value&gt;properties2&lt;/value&gt;&lt;/entries&gt;&lt;/viewRoleProperties&gt;&lt;/extendedInfo&gt;</value>
        </viewStates>
    </component>
</components>
